{
  "event_id": "evt_task_checkpoint_saved_01",
  "stream_id": "task_run:task_run_01",
  "sequence": 1,
  "event_type": "task.checkpoint_saved",
  "schema_version": 1,
  "resource_type": "task_run",
  "resource_id": "task_run_01",
  "operation_id": "task_run_01",
  "correlation_id": "correlation_01",
  "operation_status": "running",
  "domain_status": "running",
  "stage": "draft",
  "progress": 0.58,
  "payload": {
    "checkpoint_id": "checkpoint_01",
    "stage": "draft"
  },
  "occurred_at": "2026-07-15T10:21:32Z"
}
