{
  "event_id": "evt_task_stage_skipped_01",
  "stream_id": "task_run:task_run_01",
  "sequence": 1,
  "event_type": "task.stage_skipped",
  "schema_version": 1,
  "resource_type": "task_run",
  "resource_id": "task_run_01",
  "operation_id": "task_run_01",
  "correlation_id": "correlation_01",
  "operation_status": "running",
  "domain_status": "running",
  "stage": "refine",
  "progress": 0.72,
  "payload": {
    "stage": "refine",
    "reason": "Draft already met the quality target"
  },
  "occurred_at": "2026-07-15T10:21:32Z"
}
