{
  "event_id": "evt_operation_progress_01",
  "stream_id": "task_run:task_run_01",
  "sequence": 1,
  "event_type": "operation.progress",
  "schema_version": 1,
  "resource_type": "task_run",
  "resource_id": "task_run_01",
  "operation_id": "task_run_01",
  "correlation_id": "correlation_01",
  "operation_status": "running",
  "domain_status": "running",
  "stage": "research",
  "progress": 0.63,
  "payload": {
    "message": "Analyzing sources",
    "completed_units": 63,
    "total_units": 100
  },
  "occurred_at": "2026-07-15T10:21:32Z"
}
