{
  "event_id": "evt_runtime_autosave_succeeded_01",
  "stream_id": "runtime:runtime_01",
  "sequence": 1,
  "event_type": "runtime.autosave_succeeded",
  "schema_version": 1,
  "resource_type": "runtime",
  "resource_id": "runtime_01",
  "operation_id": null,
  "correlation_id": "correlation_01",
  "operation_status": null,
  "domain_status": "saved",
  "stage": "autosave",
  "progress": null,
  "payload": {
    "resource_type": "state_draft",
    "resource_id": "state_draft_01",
    "revision": 5,
    "saved_at": "2026-07-15T10:21:32Z"
  },
  "occurred_at": "2026-07-15T10:21:32Z"
}
