{
  "event_id": "evt_operation_stage_changed_01",
  "stream_id": "task_run:task_run_01",
  "sequence": 1,
  "event_type": "operation.stage_changed",
  "schema_version": 1,
  "resource_type": "task_run",
  "resource_id": "task_run_01",
  "operation_id": "task_run_01",
  "correlation_id": "correlation_01",
  "operation_status": "running",
  "domain_status": "running",
  "stage": "research",
  "progress": 0.3,
  "payload": {
    "previous_stage": "init",
    "stage": "research",
    "stage_label": "Research"
  },
  "occurred_at": "2026-07-15T10:21:32Z"
}
