{
  "event_id": "evt_monitor_usage_changed_01",
  "stream_id": "state:state_01",
  "sequence": 1,
  "event_type": "monitor.usage_changed",
  "schema_version": 1,
  "resource_type": "state",
  "resource_id": "state_01",
  "operation_id": null,
  "correlation_id": "correlation_01",
  "operation_status": null,
  "domain_status": "live",
  "stage": null,
  "progress": null,
  "payload": {
    "token_balance": 314580,
    "token_limit": 500000,
    "window": "monthly"
  },
  "occurred_at": "2026-07-15T10:21:32Z"
}
