{
  "event_id": "evt_reply_tool_status_01",
  "stream_id": "conversation:conversation_01",
  "sequence": 1,
  "event_type": "reply.tool_status",
  "schema_version": 1,
  "resource_type": "conversation",
  "resource_id": "conversation_01",
  "operation_id": "response_run_01",
  "correlation_id": "correlation_01",
  "operation_status": "running",
  "domain_status": "running",
  "stage": "response",
  "progress": null,
  "payload": {
    "tool_name": "research",
    "status": "running",
    "label": "Reviewing sources"
  },
  "occurred_at": "2026-07-15T10:21:32Z"
}
