{
  "event_id": "evt_validation_review_item_created_01",
  "stream_id": "validation_run:validation_run_01",
  "sequence": 1,
  "event_type": "validation.review_item_created",
  "schema_version": 1,
  "resource_type": "validation_run",
  "resource_id": "validation_run_01",
  "operation_id": "validation_run_01",
  "correlation_id": "correlation_01",
  "operation_status": "running",
  "domain_status": "running",
  "stage": "review",
  "progress": 0.91,
  "payload": {
    "review_item_id": "review_item_01",
    "category": "citation_quality",
    "severity": "warning",
    "title": "Add stronger references"
  },
  "occurred_at": "2026-07-15T10:21:32Z"
}
